[
  {
    "id": "flare_on_chassis",
    "name": "Flare-ON Chassis",
    "maker": "Holt-Winters Corp",
    "description": "A light, highly manoeuvrable frame from Holt-Winters aimed at pilots who want speed and attitude in a small package. Plenty of system space for modern avionics; weapon mounts suit self-defence rather than gunship work.",
    "cost": 8000,
    "mass": 3.2,
    "hits": 18,
    "mass_limit": 18.0,
    "volume": 24.0,
    "maneuver": "high",
    "hull_color": "#5ee0ff",
    "sprite": "res://assets/ships/chassis/flare_on_chassis.svg",
    "header": "res://assets/ui/ships/flare_on_chassis.png",
    "mounts": {
      "main_engine": 1,
      "power": 1,
      "system": 6,
      "light_weapon": 2,
      "medium_weapon": 1,
      "heavy_weapon": 0,
      "maneuver": 1
    }
  },
  {
    "id": "pegasus_chassis",
    "name": "Pegasus Chassis",
    "maker": "GVW Corp",
    "description": "The classic wedge-shaped workhorse hull, still built on many worlds decades after GVW folded. Generous volume and mount points count for operators who need a reliable and versatile platform.",
    "cost": 15000,
    "mass": 8.5,
    "hits": 28,
    "mass_limit": 48.0,
    "volume": 60.0,
    "maneuver": "low",
    "hull_color": "#b8a878",
    "sprite": "res://assets/ships/chassis/pegasus_chassis.svg",
    "header": "res://assets/ui/ships/pegasus_chassis.png",
    "mounts": {
      "main_engine": 1,
      "power": 1,
      "system": 9,
      "light_weapon": 3,
      "medium_weapon": 1,
      "heavy_weapon": 0,
      "maneuver": 2
    }
  },
  {
    "id": "krypton_chassis",
    "name": "Krypton Chassis",
    "maker": "Orion Aerospace",
    "description": "Orion Aerospace's distinctive saucer hull for the mid-range market. Agile for its class, with room for cargo or passenger fittings and a sensible spread of weapon hardpoints.",
    "cost": 12000,
    "mass": 6.0,
    "hits": 22,
    "mass_limit": 32.0,
    "volume": 40.0,
    "maneuver": "high",
    "hull_color": "#c8e878",
    "sprite": "res://assets/ships/chassis/krypton_chassis.svg",
    "header": "res://assets/ui/ships/krypton_chassis.png",
    "mounts": {
      "main_engine": 1,
      "power": 1,
      "system": 7,
      "light_weapon": 2,
      "medium_weapon": 1,
      "heavy_weapon": 0,
      "maneuver": 1
    }
  },
  {
    "id": "wolff_chassis",
    "name": "Wolff Chassis",
    "maker": "Bayes Inc",
    "description": "A medium-weight Bayes frame originally designed as an armed freighter. With the corp bankrupt, production has stopped, but the hull remains a popular platform with heavy-weapon capability and a forgiving load limit.",
    "cost": 18000,
    "mass": 10.0,
    "hits": 30,
    "mass_limit": 42.0,
    "volume": 50.0,
    "maneuver": "medium",
    "hull_color": "#8898a8",
    "sprite": "res://assets/ships/chassis/wolff_chassis.svg",
    "header": "res://assets/ui/ships/wolff_chassis.png",
    "mounts": {
      "main_engine": 1,
      "power": 1,
      "system": 8,
      "light_weapon": 1,
      "medium_weapon": 2,
      "heavy_weapon": 1,
      "maneuver": 2
    }
  },
  {
    "id": "dragon_chassis",
    "name": "Dragon Chassis",
    "maker": "Seven Bells Inc",
    "description": "Seven Bells Inc's compact interceptor frame, sized to carry a versatile payload. High manoeuvre and tight internal volume favour speed and firepower over cargo.",
    "cost": 16000,
    "mass": 7.5,
    "hits": 24,
    "mass_limit": 36.0,
    "volume": 44.0,
    "maneuver": "high",
    "hull_color": "#ffd060",
    "sprite": "res://assets/ships/chassis/dragon_chassis.svg",
    "header": "res://assets/ui/ships/dragon_chassis.png",
    "mounts": {
      "main_engine": 1,
      "power": 1,
      "system": 8,
      "light_weapon": 2,
      "medium_weapon": 1,
      "heavy_weapon": 0,
      "maneuver": 1
    }
  },
  {
    "id": "juno_chassis",
    "name": "Juno Chassis",
    "maker": "General Industrial",
    "description": "A stubby light scout hull from General Industrial, only a step behind the Pegasus in popularity. Modest volume and mounts suit short hops, couriers, and budget custom builds.",
    "cost": 10000,
    "mass": 5.0,
    "hits": 20,
    "mass_limit": 28.0,
    "volume": 36.0,
    "maneuver": "medium",
    "hull_color": "#a8b8d0",
    "sprite": "res://assets/ships/chassis/juno_chassis.svg",
    "header": "res://assets/ui/ships/juno_chassis.png",
    "mounts": {
      "main_engine": 1,
      "power": 1,
      "system": 6,
      "light_weapon": 2,
      "medium_weapon": 0,
      "heavy_weapon": 0,
      "maneuver": 1
    }
  },
  {
    "id": "silhouette_chassis",
    "name": "Silhouette Chassis",
    "maker": "Oklahoma Combine",
    "description": "Oklahoma Combine's flat-profile space superiority chassis. Built for orbital combat with high manoeuvre, twin medium hardpoints, and little internal volume.",
    "cost": 14000,
    "mass": 6.8,
    "hits": 22,
    "mass_limit": 34.0,
    "volume": 42.0,
    "maneuver": "high",
    "hull_color": "#d87888",
    "sprite": "res://assets/ships/chassis/silhouette_chassis.svg",
    "header": "res://assets/ui/ships/silhouette_chassis.png",
    "mounts": {
      "main_engine": 1,
      "power": 1,
      "system": 7,
      "light_weapon": 2,
      "medium_weapon": 2,
      "heavy_weapon": 0,
      "maneuver": 1
    }
  },
  {
    "id": "mantis_chassis",
    "name": "Mantis Chassis",
    "maker": "The Praetorium",
    "description": "The Praetorium's dedicated interceptor frame: optimised for manoeuvre, speed, and weapons rather than cargo or crew comfort. Expect a single-seat cockpit and bring your carry on because there's usually no hold.",
    "cost": 12000,
    "mass": 3.0,
    "hits": 16,
    "mass_limit": 18.0,
    "volume": 28.0,
    "maneuver": "high",
    "hull_color": "#c0c0c0",
    "sprite": "res://assets/ships/chassis/mantis_chassis.svg",
    "header": "res://assets/ui/ships/mantis_chassis.png",
    "mounts": {
      "main_engine": 1,
      "power": 1,
      "system": 6,
      "light_weapon": 2,
      "medium_weapon": 2,
      "heavy_weapon": 0,
      "maneuver": 1
    }
  }
]
